row,speaker,fileName,text
1,Victor,EP02_Victor_Intro_01.wav,"Welcome back to Distortion Check. I'm Victor Emil, and we're continuing our deep dive into the Ra Material. Last episode, we introduced you to the three key players: Don Elkins, Carla Rueckert, and Jim McCarty."
2,Lenny,EP02_Lenny_Intro_02.wav,"And I'm Lenny Peppidge. Today, we're going to explore what happened in those crucial early days of 1981. How did a physics professor, a librarian, and a guy living off the grid in rural Kentucky end up channeling what they believed was an extraterrestrial intelligence?"
3,Victor,EP02_Victor_Background_01.wav,"Let's start with some context. By 1981, Don Elkins had been experimenting with channeling for nearly twenty years. He wasn't some New Age dilettante. This was a man who approached the paranormal with scientific rigor."
4,Lenny,EP02_Lenny_Background_02.wav,"Right. And the channeling they had been doing up to that point was what they called conscious channeling. Carla would remain aware during the sessions, able to hear and remember what was coming through. But January 15th, 1981 changed everything."
5,Victor,EP02_Victor_Session_01.wav,"That Tuesday evening, Carla was teaching a student how to channel. It was supposed to be a routine session. But when the contact came through, something was different. The voice that spoke wasn't like the previous contacts."
6,Lenny,EP02_Lenny_Session_02.wav,"The voice said simply: 'I am Ra.' And Carla went completely unconscious. Not just relaxed or in a trance state. She was gone. Her body was there, but Carla wasn't home. Something else was operating her vocal cords."
7,Victor,EP02_Victor_Analysis_01.wav,"Now, we need to be clear here. We're not asking you to believe this was actually an extraterrestrial intelligence. What we're interested in is the material itself. What was communicated, and how much of it has turned out to be remarkably prescient."
8,Lenny,EP02_Lenny_Analysis_02.wav,"Exactly. In 1981, concepts like the observer effect in quantum mechanics, non-locality, and consciousness as fundamental to reality were still fringe ideas in mainstream science. Today, they're showing up in peer-reviewed journals."
9,Victor,EP02_Victor_Content_01.wav,"Ra claimed to be what it called a 'social memory complex' from the sixth density. It said it had previously attempted to help humanity in ancient Egypt, but that teaching had been distorted. The pyramids, according to Ra, were built as healing chambers."
10,Lenny,EP02_Lenny_Content_02.wav,"The cosmology that Ra presented was incredibly detailed and internally consistent across 106 sessions. It described eight densities of existence, the nature of consciousness evolution, and the fundamental choice between service to self and service to others."
11,Victor,EP02_Victor_Science_01.wav,"What's fascinating is how much of Ra's description of reality aligns with cutting-edge physics. The idea that space and time are illusions, that all is one at the fundamental level, that consciousness plays a primary role in shaping reality."
12,Lenny,EP02_Lenny_Science_02.wav,"But Ra also made some specific predictions and claims that we can actually verify. It talked about the nature of light, about how galaxies form, about the relationship between consciousness and matter. Some of this stuff wouldn't be discovered by mainstream science until decades later."
13,Victor,EP02_Victor_Question_01.wav,"So the question becomes: How did three people in Louisville, Kentucky in 1981 come up with information that would anticipate discoveries in quantum mechanics, consciousness research, and cosmology that wouldn't be made for decades?"
14,Lenny,EP02_Lenny_Question_02.wav,"That's what we're going to explore in this series. Session by session, claim by claim. We're going to see where Ra got it right, where it got it wrong, and what it all means for our understanding of consciousness and reality."
15,Victor,EP02_Victor_Conclusion_01.wav,"Next time, we'll dive into the first actual Ra session and start examining the specific claims and concepts. Until then, keep questioning, keep exploring, and remember: the most profound truths often sound absolutely insane until they don't."
